{
  "$schema": "statusline/component@1",
  "id": "nowplaying",
  "name": "Now Playing",
  "version": "0.1.0",
  "author": {
    "github": "zyx1121"
  },
  "description": "Currently-playing track (name — artist) from Apple Music or Spotify, truncated to 44 chars.",
  "i18n": {
    "zh-Hant": {
      "name": "正在播放",
      "description": "顯示 Apple Music 或 Spotify 正在播放的曲目（曲名 — 演出者），截斷到 44 字元。"
    },
    "zh-Hans": {
      "name": "正在播放",
      "description": "显示 Apple Music 或 Spotify 正在播放的曲目（曲名 — 演出者），截断到 44 个字符。"
    }
  },
  "type": "segment",
  "runtime": "bash",
  "render": {
    "entry": "render.sh"
  },
  "inputs": [],
  "requires": {
    "macos": [
      "AppleEvents"
    ]
  },
  "config": {},
  "placement": {
    "slot": "row2",
    "order": 40
  },
  "capabilities": {
    "stdin_fields": []
  }
}
