{
  "$schema": "statusline/component@1",
  "id": "model",
  "name": "Model Name",
  "version": "0.1.0",
  "author": { "github": "zyx1121" },
  "description": "Current model display name in cyan.",
  "type": "segment",
  "runtime": "bash",
  "render": { "entry": "render.sh" },
  "inputs": ["model.display_name"],
  "requires": {},
  "config": {},
  "placement": { "slot": "row1", "order": 10 },
  "capabilities": { "stdin_fields": ["model.display_name"] }
}
